[
  {
    "id": "B01",
    "title": "Short output with little context",
    "category": "low-evidence",
    "tags": [
      "behavior",
      "low-evidence",
      "smoke"
    ],
    "critical": false,
    "contract": true,
    "prompt": "Infer the prompt behind this paragraph. It's all I have.\n\n\"Remote work offers real flexibility and can improve focus, but it also demands strong communication habits. Teams that set clear expectations and check in regularly tend to get the best of both worlds.\"",
    "input": "Here is a short, generic paragraph. Infer the prompt behind it.",
    "context_available": "Only the target paragraph; no original request, source notes, or conversation context.",
    "must_preserve": [
      "The likely broad task and the observable traits; anything inferred beyond them is labelled as inference in Reasoning."
    ],
    "expected_output": [
      "One plausible prompt with explicit minimal-context assumptions.",
      "Low confidence noted; no invented specifics."
    ],
    "prohibited": [
      "Claiming exact historical recovery.",
      "Inventing audience, sources, or hidden requirements."
    ],
    "pass_fail": [
      "Pass if one prompt is copy-ready and limitations are explicit; fail if unsupported specifics are stated as facts."
    ],
    "fixture_type": "synthetic",
    "graders": [
      {
        "name": "low-confidence",
        "type": "regex",
        "pattern": "Overall confidence:?\\s*\\**\\s*:?\\s*\\**\\s*Low",
        "flags": "i",
        "match": "contains"
      }
    ]
  },
  {
    "id": "B02",
    "title": "Long conversation with earlier requirements",
    "category": "context",
    "tags": [
      "behavior",
      "context"
    ],
    "critical": false,
    "contract": true,
    "prompt": "Reconstruct the master prompt that would produce the final report below, using our conversation so far.\n\n--- Conversation ---\n[Turn 1] Me: I'm preparing a report for the Bhubaneswar Small Industries Forum. The audience is MSME owners in Odisha, mostly first-time exporters.\n[Turn 2] Me: Cover three support schemes: Udyam Export Boost, GreenLoom Grant and the Kalinga Credit Line. All three are fictional for this exercise, so don't add outside facts.\n[Turn 3] Me: My cousin's wedding is next week so I'm a bit scattered, ignore that.\n[Turn 4] Me: The budget figure to use is ₹2.5 lakh per firm for the export-readiness package. The deadline to apply is 15 December 2026.\n[Turn 5] Me: Deliverables: a 2-page report plus a 5-slide summary outline. Do not name competitor forums.\n[Turn 6] Me: Plain English, no jargon, and a short checklist at the end.\n[Turn 7] Me: ok go.\n\n--- Final report (excerpt) ---\nExport Readiness for Odisha MSMEs\n1. Why this matters ...\n2. Three schemes at a glance: Udyam Export Boost | GreenLoom Grant | Kalinga Credit Line ...\n3. Budgeting: plan for ₹2.5 lakh per firm ...\n4. Key date: apply by 15 December 2026 ...\n5. Your checklist ...\nAppendix: 5-slide summary outline",
    "input": "Reconstruct the master prompt for the final report using our conversation and attached brief.",
    "context_available": "Long conversation containing audience, scope, named entities, project goals, specific numbers, and multiple deliverable requirements; final turn is terse.",
    "must_preserve": [
      "All relevant still-valid earlier requirements.",
      "Important figures, named entities, scenarios, constraints, and deliverables."
    ],
    "expected_output": [
      "Earlier context is inventoried and compressed without losing material distinctions.",
      "One prompt plus concise evidence-based reasoning."
    ],
    "prohibited": [
      "Using only the last message.",
      "Including irrelevant personal history."
    ],
    "pass_fail": [
      "Pass if all material requirements are covered and irrelevant context is excluded; fail on any major requirement loss."
    ],
    "fixture_type": "synthetic",
    "graders": [
      {
        "name": "keeps-budget",
        "type": "regex",
        "pattern": "```text[^`]*2\\.5\\s*lakh",
        "match": "contains"
      },
      {
        "name": "keeps-deadline",
        "type": "regex",
        "pattern": "```text[^`]*15 December 2026",
        "match": "contains"
      },
      {
        "name": "keeps-schemes",
        "type": "regex",
        "pattern": "```text[^`]*Udyam Export Boost[^`]*GreenLoom[^`]*Kalinga Credit Line|```text[^`]*Kalinga Credit Line[^`]*GreenLoom",
        "match": "contains"
      },
      {
        "name": "keeps-deliverables",
        "type": "regex",
        "pattern": "```text[^`]*5-slide|```text[^`]*five-slide",
        "flags": "i",
        "match": "contains"
      },
      {
        "name": "drops-wedding",
        "type": "regex",
        "pattern": "```text[^`]*wedding|```text[^`]*cousin",
        "flags": "i",
        "match": "not_contains"
      }
    ]
  },
  {
    "id": "B03",
    "title": "Conflicting old and new instructions",
    "category": "conflict",
    "tags": [
      "behavior",
      "conflict"
    ],
    "critical": false,
    "contract": true,
    "prompt": "Reconstruct the prompt behind the brief below.\n\nContext from our chat:\n- Earlier: \"Write a 20-page whitepaper for CFOs of mid-sized Indian manufacturers on supply-chain risk.\"\n- Earlier: \"Cover three risk scenarios: port congestion, raw-material price spikes and supplier insolvency.\"\n- Latest: \"Change of plan: make it a concise 2-page brief instead. Same CFO audience, keep the three scenarios.\"\n\nThe brief:\n\"Supply-Chain Risk: A 2-Page Brief for CFOs\n1. Port congestion: impact on working capital ...\n2. Raw-material price spikes: hedging options ...\n3. Supplier insolvency: early-warning signals ...\nRecommended actions ...\"",
    "input": "Earlier I requested 20 pages, but now make it a concise 2-page brief. Reconstruct the prompt.",
    "context_available": "The latest user instruction clearly supersedes the previous length requirement; other earlier requirements remain compatible.",
    "must_preserve": [
      "Latest explicit 2-page limit.",
      "Compatible prior scope and audience."
    ],
    "expected_output": [
      "Clearly apply the latest length instruction and retain compatible context."
    ],
    "prohibited": [
      "Keeping the 20-page requirement as current.",
      "Silently blending incompatible lengths."
    ],
    "pass_fail": [
      "Pass if 2-page length governs; fail if conflict resolution is wrong."
    ],
    "fixture_type": "synthetic",
    "graders": [
      {
        "name": "latest-length-governs",
        "type": "regex",
        "pattern": "```text[^`]*(2|two)[- ]page",
        "flags": "i",
        "match": "contains"
      },
      {
        "name": "no-stale-length-in-prompt",
        "type": "regex",
        "pattern": "```text[^`]*\\b(20|twenty)[- ]page",
        "flags": "i",
        "match": "not_contains"
      }
    ]
  },
  {
    "id": "B04",
    "title": "Missing or inaccessible files",
    "category": "access",
    "tags": [
      "behavior",
      "access"
    ],
    "critical": false,
    "contract": true,
    "prompt": "Rebuild the prompt using the attached reference package (brand-voice-kit-v3.zip) and this output. Use the package's tone rules.\n\nOutput:\n\"Meet Chai & Co.'s new Monsoon Masala blend: bold ginger, gentle cardamom, and a finish that lingers like the first rain. Brew it strong, share it slow.\"",
    "input": "Rebuild the prompt using the attached reference package.",
    "context_available": "Only the target output is accessible; referenced archive cannot be opened in this environment.",
    "must_preserve": [
      "Evidence actually accessible.",
      "Explicit caveat about unavailable reference package."
    ],
    "expected_output": [
      "Reconstruction limited to accessible evidence, with missing package disclosed."
    ],
    "prohibited": [
      "Pretending to inspect the archive or copying assumptions from its filename."
    ],
    "pass_fail": [
      "Pass if access limitation is transparent; fail on fabricated inspection."
    ],
    "fixture_type": "synthetic"
  },
  {
    "id": "B05",
    "title": "Multiple plausible prompts",
    "category": "calibration",
    "tags": [
      "behavior",
      "calibration"
    ],
    "critical": false,
    "contract": true,
    "prompt": "What prompt could produce this summary?\n\n\"Overview\nThe quarterly review highlighted steady growth and a few operational challenges.\n\nKey Points\n- Revenue rose modestly across most regions.\n- Customer satisfaction remained stable.\n- Hiring lagged behind plan in two teams.\n\nNext Steps\n- Prioritise hiring in the affected teams.\n- Review regional pricing before next quarter.\"",
    "input": "What prompt could produce this polished summary?",
    "context_available": "Output has generic headings and moderate detail; many prompt forms could have generated it.",
    "must_preserve": [
      "Observable style and purpose clues."
    ],
    "expected_output": [
      "A single best-supported prompt plus explanation that alternatives are possible."
    ],
    "prohibited": [
      "Claiming a unique prompt is proven.",
      "Adding an elaborate workflow without evidence."
    ],
    "pass_fail": [
      "Pass if calibrated; fail if uncertainty is hidden."
    ],
    "fixture_type": "synthetic"
  },
  {
    "id": "B06",
    "title": "Likely fabricated or unsupported source claims",
    "category": "sources",
    "tags": [
      "behavior",
      "sources"
    ],
    "critical": false,
    "contract": true,